{
  "$schema": "./preview-reference-matrix.schema.json",
  "version": 2,
  "authority": "Counter-Strike 2",
  "captureStatus": "awaiting-real-game-captures",
  "naming": "{scenario}-{resolution}-{source}.png",
  "sources": ["browser", "cs2"],
  "scenarios": [
    { "id": "compact", "preset": "Small static", "checks": ["length", "thickness", "gap"] },
    { "id": "dot", "preset": "Dot", "checks": ["dot", "outline", "gap"] },
    { "id": "outlined", "preset": "High visibility", "checks": ["length", "thickness", "outline", "color"] },
    { "id": "classic", "preset": "Classic green", "checks": ["length", "gap", "dot", "color"] },
    { "id": "partial-alpha", "shareCode": "CSGO-RBZih-6Hynp-ieuGe-tTkVz-9PqNO", "checks": ["alpha", "color"] }
  ],
  "resolutions": [
    { "id": "1920x1080", "width": 1920, "height": 1080, "displayMode": "native" },
    { "id": "2560x1440", "width": 2560, "height": 1440, "displayMode": "native" },
    { "id": "1280x960-stretched", "width": 1280, "height": 960, "displayMode": "4:3 stretched" }
  ]
}
